{
  "standardVersion": "3.0.0",
  "toolVersion": "design-lab 0.23.1",
  "generatedAt": "2026-10-06T23:10:34Z",
  "canonicalBaseUrl": "https://www.pncb.org",
  "captures": {
    "paragraph:accordion": {
      "path": "/safeguarding-future-pediatric-care",
      "verificationUrl": "https://pncb-2026-merge.ddev.site/safeguarding-future-pediatric-care",
      "linkUrl": "https://www.pncb.org/safeguarding-future-pediatric-care",
      "selector": "[data-design-lab-root=\"paragraph:accordion\"]",
      "states": [
        "default"
      ],
      "images": [
        {
          "file": "/fixture/.design/pncb/2026-10-06/capture/shots/paragraph__accordion__desktop.png",
          "hash": "sha256:6e380521ddeb1f69077c7751be4723e0a62b85df8e78674416f7819b7e3cabfb",
          "viewport": "Desktop",
          "state": "default",
          "width": 792,
          "height": 2431
        },
        {
          "file": "/fixture/.design/pncb/2026-10-06/capture/shots/paragraph__accordion__tablet.png",
          "hash": "sha256:a6d2d14e7546665364fe8f976cb31729304a8fd9a2778a78616aa6c754677a06",
          "viewport": "Tablet",
          "state": "default",
          "width": 640,
          "height": 2753
        },
        {
          "file": "/fixture/.design/pncb/2026-10-06/capture/shots/paragraph__accordion__mobile.png",
          "hash": "sha256:6269b9a7375a76ea50e8be4caa79261caf43427ff0a2b8d3532a13fa49d11149",
          "viewport": "Mobile",
          "state": "default",
          "width": 295,
          "height": 5676
        }
      ]
    },
    "paragraph:accordion_callout": {
      "path": "/cpn-exam-resources",
      "verificationUrl": "https://pncb-2026-merge.ddev.site/cpn-exam-resources",
      "linkUrl": "https://www.pncb.org/cpn-exam-resources",
      "selector": "[data-design-lab-root=\"paragraph:accordion_callout\"]",
      "states": [
        "default"
      ],
      "images": [
        {
          "file": "/fixture/.design/pncb/2026-10-06/capture/shots/paragraph__accordion_callout__desktop.png",
          "hash": "sha256:392a2fa1aebc691496a91ad9eb95b6a621a2e6bd879f72fb4f9d359138c8e32e",
          "viewport": "Desktop",
          "state": "default",
          "width": 742,
          "height": 112
        },
        {
          "file": "/fixture/.design/pncb/2026-10-06/capture/shots/paragraph__accordion_callout__tablet.png",
          "hash": "sha256:a635bfa4f226d8af23a0b293ed845547758fb5161a10a687e3b8cb5d526e3756",
          "viewport": "Tablet",
          "state": "default",
          "width": 590,
          "height": 112
        },
        {
          "file": "/fixture/.design/pncb/2026-10-06/capture/shots/paragraph__accordion_callout__mobile.png",
          "hash": "sha256:b12146345db8c779588f5d7eabc67f7b72f336891855be19c82ab98b4658706b",
          "viewport": "Mobile",
          "state": "default",
          "width": 245,
          "height": 112
        }
      ]
    },
    "paragraph:accordion_item": {
      "path": "/pediatric-nurse-interviews",
      "verificationUrl": "https://pncb-2026-merge.ddev.site/pediatric-nurse-interviews",
      "linkUrl": "https://www.pncb.org/pediatric-nurse-interviews",
      "selector": "[data-design-lab-root=\"paragraph:accordion_item\"]",
      "states": [
        "default"
      ],
      "images": [
        {
          "file": "/fixture/.design/pncb/2026-10-06/capture/shots/paragraph__accordion_item__desktop.png",
          "hash": "sha256:5dfc74bebb6b681c254a93bfd78733de3edb93eb824a45b290383cb32acf19de",
          "viewport": "Desktop",
          "state": "default",
          "width": 792,
          "height": 2221
        },
        {
          "file": "/fixture/.design/pncb/2026-10-06/capture/shots/paragraph__accordion_item__tablet.png",
          "hash": "sha256:bbd73a9fe6cd5fc74c93059de018f6ebd5c03fb8e6142cca41dc3d3d0c848386",
          "viewport": "Tablet",
          "state": "default",
          "width": 640,
          "height": 2567
        },
        {
          "file": "/fixture/.design/pncb/2026-10-06/capture/shots/paragraph__accordion_item__mobile.png",
          "hash": "sha256:2fd102f595c8dede4a8ccbdcceaaab2ec391269f77c63afd2cf21b6405943142",
          "viewport": "Mobile",
          "state": "default",
          "width": 295,
          "height": 5782
        }
      ]
    },
    "paragraph:betty_bot": {
      "path": "/ask-pncbee",
      "verificationUrl": "https://pncb-2026-merge.ddev.site/ask-pncbee",
      "linkUrl": "https://www.pncb.org/ask-pncbee",
      "selector": "[data-design-lab-root=\"paragraph:betty_bot\"]",
      "states": [
        "default"
      ],
      "images": [
        {
          "file": "/fixture/.design/pncb/2026-10-06/capture/shots/paragraph__betty_bot__desktop.png",
          "hash": "sha256:b0ec268c9bbf5e28b7c264cd59e43c62a76952385295363c3311d6e44fc1289c",
          "viewport": "Desktop",
          "state": "default",
          "width": 792,
          "height": 659
        },
        {
          "file": "/fixture/.design/pncb/2026-10-06/capture/shots/paragraph__betty_bot__tablet.png",
          "hash": "sha256:f581d681cb41190fb49ad8493bbb089ad118956df2f10262865d65b798ab35d9",
          "viewport": "Tablet",
          "state": "default",
          "width": 640,
          "height": 615
        },
        {
          "file": "/fixture/.design/pncb/2026-10-06/capture/shots/paragraph__betty_bot__mobile.png",
          "hash": "sha256:32b45c1ae236d10f3336a05a5997924c061cd2753e386ea3902d35854f7a3253",
          "viewport": "Mobile",
          "state": "default",
          "width": 295,
          "height": 951
        }
      ]
    },
    "paragraph:card": {
      "path": "/news/exam-candidate-faqs",
      "verificationUrl": "https://pncb-2026-merge.ddev.site/news/exam-candidate-faqs",
      "linkUrl": "https://www.pncb.org/news/exam-candidate-faqs",
      "selector": "[data-design-lab-root=\"paragraph:card\"]",
      "states": [
        "default"
      ],
      "images": [
        {
          "file": "/fixture/.design/pncb/2026-10-06/capture/shots/paragraph__card__desktop.png",
          "hash": "sha256:4e5fc697392d436490cb28fe07dfc6b2a9c81c6c787d1e3f4c1e67725a9c535f",
          "viewport": "Desktop",
          "state": "default",
          "width": 460,
          "height": 477
        },
        {
          "file": "/fixture/.design/pncb/2026-10-06/capture/shots/paragraph__card__tablet.png",
          "hash": "sha256:b15f7b3c1651eb2f98078a243769744923d3585785e88cce75d1331edc507024",
          "viewport": "Tablet",
          "state": "default",
          "width": 368,
          "height": 592
        },
        {
          "file": "/fixture/.design/pncb/2026-10-06/capture/shots/paragraph__card__mobile.png",
          "hash": "sha256:b1ea7351bb8c668bbf666c8f61dd30130ed8031c0ee9ffded2c05b94623fe6a4",
          "viewport": "Mobile",
          "state": "default",
          "width": 253,
          "height": 972
        }
      ]
    },
    "paragraph:cta_block": {
      "path": "/homepage",
      "verificationUrl": "https://pncb-2026-merge.ddev.site/homepage",
      "linkUrl": "https://www.pncb.org/homepage",
      "selector": "[data-design-lab-root=\"paragraph:cta_block\"]",
      "states": [
        "default"
      ],
      "images": [
        {
          "file": "/fixture/.design/pncb/2026-10-06/capture/shots/paragraph__cta_block__desktop.png",
          "hash": "sha256:227935a24c0a25120f7072de4e41b00b4663765509f65d61a35991b277ae5a25",
          "viewport": "Desktop",
          "state": "default",
          "width": 397,
          "height": 440
        },
        {
          "file": "/fixture/.design/pncb/2026-10-06/capture/shots/paragraph__cta_block__tablet.png",
          "hash": "sha256:beb595f2c4f6becf39e5649ca8d0ece62a0b79294ed3e3acff139813a903f8e0",
          "viewport": "Tablet",
          "state": "default",
          "width": 197,
          "height": 373
        },
        {
          "file": "/fixture/.design/pncb/2026-10-06/capture/shots/paragraph__cta_block__mobile.png",
          "hash": "sha256:92e6413377403605abb59a4a286adf4b50e62cf1a464b74238a0836b4d153c49",
          "viewport": "Mobile",
          "state": "default",
          "width": 295,
          "height": 380
        }
      ]
    },
    "paragraph:cta_grid": {
      "path": "/homepage",
      "verificationUrl": "https://pncb-2026-merge.ddev.site/homepage",
      "linkUrl": "https://www.pncb.org/homepage",
      "selector": "[data-design-lab-root=\"paragraph:cta_grid\"]",
      "states": [
        "default"
      ],
      "images": [
        {
          "file": "/fixture/.design/pncb/2026-10-06/capture/shots/paragraph__cta_grid__desktop.png",
          "hash": "sha256:31dcc7132c4ec62cb58864b3a9074015f3a4ca83bbcc28d9858060c8da8f5311",
          "viewport": "Desktop",
          "state": "default",
          "width": 1320,
          "height": 1119
        },
        {
          "file": "/fixture/.design/pncb/2026-10-06/capture/shots/paragraph__cta_grid__tablet.png",
          "hash": "sha256:ff82c5564f2f1e5343b8eea8f1cd6e8c4095ef25133fd56671715b240b9f1731",
          "viewport": "Tablet",
          "state": "default",
          "width": 720,
          "height": 1059
        },
        {
          "file": "/fixture/.design/pncb/2026-10-06/capture/shots/paragraph__cta_grid__mobile.png",
          "hash": "sha256:da56157d4a2bb0efdd6020a5400998a1707fedecb6a781abc3023626926e1ad3",
          "viewport": "Mobile",
          "state": "default",
          "width": 335,
          "height": 2233
        }
      ]
    },
    "paragraph:faces_of_certification": {
      "path": "/faces-certification",
      "verificationUrl": "https://pncb-2026-merge.ddev.site/faces-certification",
      "linkUrl": "https://www.pncb.org/faces-certification",
      "selector": ".paragraph--type--faces-of-certification",
      "states": [
        "default"
      ],
      "images": [
        {
          "file": "/fixture/.design/pncb/2026-10-06/capture/shots/paragraph__faces_of_certification__desktop.png",